jobid,reason,requirement
606346,"This job deals with various aspects of business operation, thus requiring a high-level of expertise.","A master's degree from an accredited college or university in related fields such as economics, finance, accounting, business or public administration, or human resources management."
606346,The tasks described in the job post require experience to be carried out effectively and efficiently.,"One year of satisfactory full-time professional experience in related areas such as budget administration, accounting, economic or financial administration, fiscal or economic research."
606346,The nature of this job requires excellent project management and organizational skills to manage multiple tasks simultaneously and ensure smooth operation.,Project management experience and demonstrated organizational skills.
606346,Effective communication is crucial in this job role since it aids in the clear conveyance of plans and strategies to team members.,Excellent oral and written communication skills.
606346,The job involves working with multiple technological tools to streamline tasks and requires proficiency in them.,Proficiency with Microsoft Office and the ability to seamlessly use technology to execute/streamline tasks.
571361,"The job demands handling of capital construction projects with large budgets, hence, prior experience is crucial to ensure efficient project management.","At least six years of full-time satisfactory experience in construction management work on capital projects, each one of which must have had a dollar value of at least $15,000."
571361,Managerial expertise is critical in this role which includes overseeing teams and projects.,At least eighteen months of experience in a managerial or consultative capacity in an organization responsible for management of construction.
571361,The job requires technical knowledge and proficiency specific to construction or architecture.,"A bachelor's degree in architecture, landscape architecture, or related engineering fields or a State license as a professional engineer or registered architect."
571361,Executive Program Manager is expected to coordinate with multiple teams and stakeholders making communication skills highly critical.,Excellent oral and written communication skills towards a technical and non-technical audience.
571361,"The job requires the ability to examine, understand, and enhance existing work processes.",Business process analysis skills with strong ability to understand and assess existing processes and identify potential improvements.
571361,"This job position involves managing projects and team members, hence, the need for strong organizational and supervisory capabilities.","Managerial training and/or extensive managerial experience, excellent organizational and analytical skills."
